{
  "schema_version": "2.0",
  "skill": "asg-seo-writer-v2",
  "skill_version": "0.1.0",
  "run_id": "run-ASG-044-2026-05-16",
  "article_id": "ASG-044",
  "stage": "production",
  "timestamp": "2026-05-16T10:50:00Z",
  "status": "ok",
  "next_skill": "asg-editorial-gate",
  "human_gate": true,
  "library_refs": ["FACT-001", "FACT-002", "FACT-010", "FACT-011", "FACT-020", "FACT-021", "FACT-031", "FACT-040", "FACT-041", "FACT-042", "CASE-001", "CASE-007", "SOURCE-001", "SOURCE-002", "SOURCE-003", "SOURCE-010", "SOURCE-011", "SOURCE-020", "SOURCE-030"],
  "input": {
    "phase": "draft",
    "article_type": "pillar",
    "filter_report": { "decision": "GO", "recommended_article_type": "pillar", "cluster": "UK" },
    "keyword_spec": { "primary_keyword": { "term": "uk dropshipping suppliers" }, "cluster_relations": { "cluster": "UK", "internal_link_recommendations": ["#37", "#42", "#43"] } },
    "performance_ref": null
  },
  "output": {
    "draft": {
      "html": "<article>... pillar body, en-GB, ~3600 words ...</article>",
      "rank_math_settings": { "focus_keyword": "uk dropshipping suppliers", "pillar_content": true },
      "asset_manifest": {
        "internal_links": ["#37", "#42", "#43", "#1"],
        "external_links": ["SOURCE-001", "SOURCE-002", "SOURCE-003", "SOURCE-010", "SOURCE-011", "SOURCE-020"],
        "asg_data_refs": ["FACT-001", "FACT-002", "FACT-010", "FACT-011", "FACT-020", "FACT-021", "FACT-040", "FACT-041", "FACT-042", "CASE-007", "CASE-001"]
      },
      "h2_blocks": [
        { "heading": "What UK dropshipping suppliers actually cost", "library_refs": ["CASE-007", "FACT-021"], "has_answer_block": true, "has_key_takeaway": true },
        { "heading": "How we vet UK-facing suppliers", "library_refs": ["FACT-001", "FACT-010"], "has_answer_block": true, "has_key_takeaway": true },
        { "heading": "DDP and VAT realities for UK delivery", "library_refs": ["SOURCE-001", "FACT-021"], "has_answer_block": true, "has_key_takeaway": true },
        { "heading": "Lead times you can promise customers", "library_refs": ["FACT-021", "FACT-031"], "has_answer_block": true, "has_key_takeaway": true },
        { "heading": "A real UK shipping cost turnaround", "library_refs": ["CASE-007"], "has_answer_block": true, "has_key_takeaway": true },
        { "heading": "Scaling a UK store without breaking fulfilment", "library_refs": ["CASE-001", "FACT-041"], "has_answer_block": true, "has_key_takeaway": true }
      ],
      "schema_blocks": ["Article", "FAQPage", "BreadcrumbList", "HowTo"],
      "title_options": [
        { "title": "UK Dropshipping Suppliers: The Real Cost and Lead-Time Breakdown", "ctr_reference": "no-history" },
        { "title": "UK Dropshipping Suppliers — What 8 Years of Fulfilment Taught Us", "ctr_reference": "no-history" },
        { "title": "How to Choose UK Dropshipping Suppliers (Without the Margin Leak)", "ctr_reference": "no-history" },
        { "title": "UK Dropshipping Suppliers: DDP, VAT and the Numbers That Matter", "ctr_reference": "no-history" },
        { "title": "The UK Dropshipping Suppliers Guide We Wish New Stores Read First", "ctr_reference": "no-history" }
      ]
    },
    "meta_variants": null
  },
  "audit": { "warnings": ["external_links=6 below pillar minimum 10 — gate will catch"], "errors": [], "rulebook_refs": ["asg-publishing-gate.md#A", "asg-voice-bible.md"], "duration_ms": null }
}
